{"artifact":"archbird-test-symbol-observations","cases":[{"group":"c","path":"test/test_core.c","selector":"core.basic","symbols":[{"hits":1,"path":"src/core.c","symbol":"core_run"}]}],"producer":{"configuration_sha256":"4444444444444444444444444444444444444444444444444444444444444444","implementation_sha256":"5555555555555555555555555555555555555555555555555555555555555555","name":"fuzz-symbol-runner","runtime":"fixture","version":"1"},"project":"fuzz","provenance":"observed","schema_version":1,"source":{"config_sha256":"6666666666666666666666666666666666666666666666666666666666666666","evidence":[{"path":"runner.sh","role":"runner","sha256":"1111111111111111111111111111111111111111111111111111111111111111"},{"path":"src/core.c","role":"subject","sha256":"2222222222222222222222222222222222222222222222222222222222222222"},{"path":"test/test_core.c","role":"test_inventory","sha256":"3333333333333333333333333333333333333333333333333333333333333333"}],"evidence_slice_sha256":"84a7619842e5eaf2a48ed67751b69c1b3a971489eea30432722e8f469f496c5f","map_input_sha256":"7777777777777777777777777777777777777777777777777777777777777777"}}
